{
  "schema_version": "selector-plan/v4",
  "plan_id": "plan-20260313-perf-exp-003",
  "request_id": "req-20260313-perf-exp-003",
  "created_at": "2026-03-13T13:02:00Z",
  "origin_stage": "intake",
  "query_stage": "atomic",
  "task_family": "performance_analysis",
  "execution_mode": "direct_atomic_workflow",
  "analysis_depth": "none",
  "deliverable_contract": "analysis_report",
  "work_package_id": "wp-estimate-performance-envelope",
  "work_package_goal": "估算 qwen3-next-32b 在 A2 TP4 BF16 8k 下的预期 TTFT、吞吐和显存范围",
  "consumer_id": "model-expected-performance-estimator",
  "logical_domains": [
    "validation_evidence",
    "deployment_config",
    "ascend_foundation"
  ],
  "physical_shard_hints": [
    "validation",
    "repo_semantics",
    "hw_runtime_caps"
  ],
  "budget_class": "atomic",
  "capsule_type": "atomic_capsule",
  "query_trigger_codes": [
    "baseline_or_policy_lookup",
    "operator_constraint_lookup"
  ],
  "selectors": {
    "files": [],
    "symbols": [],
    "entities": [
      "baseline.expectation.qwen3-next-32b.a2",
      "repo.policy.prefill"
    ],
    "errors": [],
    "models": [
      "qwen3-next-32b"
    ],
    "features": [
      "prefill",
      "decode",
      "tp4",
      "bf16",
      "ctx8k"
    ],
    "hw": [
      "A2"
    ],
    "commits": [],
    "prs": [],
    "versions": [
      "vllm-ascend@0.13.0"
    ],
    "configs": [
      "tp4_bf16_ctx8k"
    ]
  },
  "must_have": [
    "expected TTFT range",
    "expected throughput range",
    "memory headroom assumptions"
  ],
  "nice_to_have": [
    "closest comparable baseline",
    "top sensitivity factors"
  ],
  "requested_token_cap": 1500,
  "max_capsules": 1,
  "max_deep_refs": 1,
  "hop_limit": 1,
  "stop_after_first_sufficient": true,
  "why_this_query_now": "当前用户要的是预期性能量级，而不是对真实 profile 做 root-cause 拆解。",
  "why_default_focus_not_enough": null,
  "burst_reason_code": null,
  "notes": "若 batch size 缺失，可输出范围和敏感因子，但不能伪造单点结论。"
}
