{
  "schema_version": "selector-plan/v4",
  "plan_id": "plan-20260313-val-004",
  "request_id": "req-20260313-val-004",
  "created_at": "2026-03-13T12:15:00Z",
  "origin_stage": "intake",
  "query_stage": "atomic",
  "task_family": "validation_strategy",
  "execution_mode": "direct_atomic_workflow",
  "analysis_depth": "none",
  "deliverable_contract": "analysis_report",
  "work_package_id": "wp-select-minimum-tests",
  "work_package_goal": "根据 diff 和已有资产选择最小必跑集",
  "consumer_id": "change-impact-test-selector",
  "logical_domains": [
    "validation_evidence",
    "deployment_config",
    "vllm_ascend_core"
  ],
  "physical_shard_hints": [
    "validation",
    "repo_semantics"
  ],
  "budget_class": "atomic",
  "capsule_type": "atomic_capsule",
  "query_trigger_codes": [
    "validation_matrix_lookup",
    "code_surface_lookup"
  ],
  "selectors": {
    "files": [
      "tests/test_model_runner.py",
      "vllm_ascend/platform.py"
    ],
    "symbols": [
      "Platform.initialize"
    ],
    "entities": [
      "validation.matrix.prefill",
      "repo.feature.dynamic_batching"
    ],
    "errors": [],
    "models": [
      "qwen3-next"
    ],
    "features": [
      "dynamic_batching"
    ],
    "hw": [
      "A2"
    ],
    "commits": [
      "1234abcd"
    ],
    "prs": [],
    "versions": [
      "vllm-ascend@main"
    ],
    "configs": []
  },
  "must_have": [
    "受影响测试集",
    "最小必跑门槛",
    "缺失资产提示"
  ],
  "nice_to_have": [
    "相关 smoke 记录"
  ],
  "requested_token_cap": 1400,
  "max_capsules": 1,
  "max_deep_refs": 1,
  "hop_limit": 1,
  "stop_after_first_sufficient": true,
  "why_this_query_now": "当前问题是最小测试选择，不应升级为 bug triage 或全量覆盖设计。",
  "why_default_focus_not_enough": null,
  "burst_reason_code": null,
  "notes": "若资产不足，应输出低置信补采建议"
}
